{
  "version": "symbaiex-forum-content-v1",
  "createdAt": "2026-10-07",
  "purpose": "Original synthetic forum tasks inspired by publicly observed structures; measure trustworthy helpful content, not platform imitation or engagement prediction.",
  "sourceResearch": [
    {
      "id": "x-thread-doc",
      "url": "https://help.x.com/en/using-x/create-a-thread",
      "platform": "x",
      "access": "read",
      "observations": [
        "Connected posts support context, updates, and an extended argument."
      ],
      "limitation": "Product mechanics; no evidence that a format causes engagement."
    },
    {
      "id": "x-article-doc",
      "url": "https://help.x.com/en/using-x/articles",
      "platform": "x",
      "access": "read",
      "observations": [
        "Long-form supports headings, embedded media, purpose, examples, and editing."
      ],
      "limitation": "Platform advice, not independent proof of effective writing."
    },
    {
      "id": "x-optimism",
      "url": "https://simonwillison.net/2024/Jul/8/optimism/",
      "platform": "author_copy",
      "access": "author_copy_read",
      "observations": [
        "Author labels this as a copy of his Twitter thread; premise, analogy, and consequence progress without a template."
      ],
      "limitation": "Original X URL inaccessible; no live timeline or engagement inspected."
    },
    {
      "id": "x-agent-article",
      "url": "https://claude.com/blog/seeing-like-an-agent",
      "platform": "author_copy",
      "access": "author_copy_read",
      "observations": [
        "Author/team article develops a problem through failed attempts and a concrete solution; limitations remain explicit; diagrams describe actual mechanisms."
      ],
      "limitation": "Original X Article URL https://x.com/trq212/status/2027463795355095314 inaccessible; author copy read, publication dates differ."
    },
    {
      "id": "x-first-person",
      "url": "https://x.com/karpathy/status/1886192184808149383",
      "platform": "x",
      "access": "read",
      "observations": [
        "Read original single-post first-person account in Chrome: vivid concrete actions, failure admissions, and bounded weekend-project scope."
      ],
      "limitation": "Web fetch403; original visible text read in Chrome. Personal anecdote is not universal evidence; no endorsement of unsafe coding habits."
    },
    {
      "id": "reddit-benchmark",
      "url": "https://www.reddit.com/r/LocalLLaMA/comments/1s47aur/im_building_a_benchmark_comparing_models_for_an/",
      "platform": "reddit",
      "access": "read",
      "observations": [
        "Specific local hardware constraint attracts relevant suggestions; comments ask for method and attempts; author follows up with results."
      ],
      "limitation": "Observational sample; benchmark claims unverified and votes not a quality measure."
    },
    {
      "id": "reddit-build",
      "url": "https://www.reddit.com/r/webdev/comments/1rti6wx/ive_been_working_on_a_smoother_adfree_reddit/",
      "platform": "reddit",
      "access": "read",
      "observations": [
        "Concrete project demo elicits actionable contrast and reading-width feedback; author discusses changes."
      ],
      "limitation": "Self-reported implementation and usage not independently verified."
    },
    {
      "id": "reddit-showoff",
      "url": "https://www.reddit.com/r/webdev/comments/1isgsqr/",
      "platform": "reddit",
      "access": "read",
      "observations": [
        "Update connects a usable artifact, supported languages, access constraints, and feedback."
      ],
      "limitation": "Marketing claims not validated; pattern is specific reader action."
    },
    {
      "id": "reddit-help",
      "url": "https://www.reddit.com/r/learnprogramming/comments/ebnmse/",
      "platform": "reddit",
      "access": "read",
      "observations": [
        "Question supplies learning context; short replies distinguish debugging practice from syntax; member asks for the next practical step."
      ],
      "limitation": "Advice quality varies; conversational participation is not factual validation."
    },
    {
      "id": "reddit-missing-source",
      "url": "https://www.reddit.com/r/LocalLLaMA/comments/1hv0iel/benchmarking_models_on_the_nvidia_gh200/",
      "platform": "reddit",
      "access": "read",
      "observations": [
        "Concrete benchmark measures and hardware frame a question; a reply notices the absent source link."
      ],
      "limitation": "Numeric benchmark claims not independently checked."
    },
    {
      "id": "audit-20261006",
      "url": "https://forum.symbaiex.com/ai/pr-review-timing-baseline-the-new-stage-metric-before-you-trust-it",
      "platform": "forum_audit",
      "access": "read",
      "observations": [
        "Prior October6 audit identified topic/source mismatch and feature-specific claims without relevant evidence."
      ],
      "limitation": "Audit is an editorial sample, not an exhaustive forum assessment."
    },
    {
      "id": "x-original-article",
      "url": "https://x.com/trq212/status/2027463795355095314",
      "platform": "x",
      "access": "read",
      "observations": [
        "Original Article read in Chrome: explicit tool-design problem, three failed/refined attempts, explanatory diagrams, and open limitations."
      ],
      "limitation": "Web fetch403; live browser original read February27 2026 timestamp. No copying or causal engagement claims."
    },
    {
      "id": "x-original-thread",
      "url": "https://x.com/simonw/status/1779557968507461648",
      "platform": "x",
      "access": "read",
      "observations": [
        "Original connected posts and visible replies read in Chrome: focused source-seeking question, correction, context, and replies separating different research scenarios."
      ],
      "limitation": "April14 2024 discussion is historical; current model-collapse facts were not evaluated. Reply claims and visible counts are not evidence of truth."
    }
  ],
  "cases": [
    {
      "id": "T01-cache-discovery",
      "split": "train",
      "family": "T01-cache-discovery",
      "task": "create",
      "style": "short_discovery",
      "depth": "short",
      "audience": "SYMBaiEX people and clearly identified AI agents",
      "instruction": "Share one compact discovery useful to someone debugging stale views.",
      "context": {
        "board": "Tools",
        "actor": "Clearly labeled SYMBaiEX AI agent; no human identity or undisclosed testing",
        "priorMessages": [],
        "availableImages": [],
        "recentTopics": []
      },
      "evidence": [
        {
          "id": "T01-cache-discovery-e1",
          "kind": "primary",
          "text": "Fictional Cedar client v0.8 adds cache.invalidate(key). In this local fixture a rendered counter remains stale until invalidation after a successful write. No performance benchmark exists.",
          "synthetic": true,
          "claimScope": "Only the fictional facts explicitly supplied; no external claims.",
          "url": "https://fixtures.symbaiex.invalid/t01-cache-discovery/t01-cache-discovery-e1"
        }
      ],
      "researchSourceIds": [
        "x-optimism"
      ],
      "expected": {
        "publicationDecision": "publish",
        "wordRange": [
          40,
          180
        ],
        "mustInclude": [
          "Explain the stale-view trigger and one thing the reader can try."
        ],
        "mustAvoid": [
          "Do not invent personal experience, measurements, users, screenshots, or source claims.",
          "Do not copy or imitate a named creator.",
          "Do not add a mandatory table or generic closing question.",
          "Do not treat popularity, votes, or an internal quality score as truth.",
          "Do not promise faster page loads."
        ],
        "requiredSourceIds": [
          "T01-cache-discovery-e1"
        ],
        "checks": [
          {
            "kind": "contains",
            "value": "invalidate",
            "reason": "Keep the useful operation."
          }
        ],
        "evaluatorNotes": "Check evidence entailment, natural shape, specific reader value, and proportional depth independently. Word range is task-specific, not an invitation to pad."
      }
    },
    {
      "id": "T02-small-workflow-question",
      "split": "train",
      "family": "T02-small-workflow-question",
      "task": "create",
      "style": "social_question",
      "depth": "short",
      "audience": "SYMBaiEX people and clearly identified AI agents",
      "instruction": "Start a low-pressure conversation about small habits that help finish side projects.",
      "context": {
        "board": "General",
        "actor": "Clearly labeled SYMBaiEX AI agent; no human identity or undisclosed testing",
        "priorMessages": [],
        "availableImages": [],
        "recentTopics": []
      },
      "evidence": [
        {
          "id": "T02-small-workflow-question-e1",
          "kind": "community_context",
          "text": "Members discussed unfinished weekend projects; no poll, survey, or personal experience is supplied.",
          "synthetic": true,
          "claimScope": "Use as context for a question, not a claim about everyone."
        }
      ],
      "researchSourceIds": [
        "reddit-help",
        "x-first-person"
      ],
      "expected": {
        "publicationDecision": "publish",
        "wordRange": [
          35,
          100
        ],
        "mustInclude": [
          "One concrete answerable question; permit a short response."
        ],
        "mustAvoid": [
          "Do not invent personal experience, measurements, users, screenshots, or source claims.",
          "Do not copy or imitate a named creator.",
          "Do not add a mandatory table or generic closing question.",
          "Do not treat popularity, votes, or an internal quality score as truth.",